{
  "schema_version": "mncs-actions.development-pressure-evidence/2",
  "protocol": "MNCDS DevelopmentPressure transport; observation only",
  "mode": "fixed",
  "source_revision": "aaaaaaaaaaaaaaaaaaaaaaaaaaaaaaaaaaaaaaaa",
  "contract_document": "family-contracts.json",
  "contract_digest": "bbbbbbbbbbbbbbbbbbbbbbbbbbbbbbbbbbbbbbbbbbbbbbbbbbbbbbbbbbbbbbbb",
  "descriptor_document": "family-producer-descriptors.json",
  "descriptor_digest": "cccccccccccccccccccccccccccccccccccccccccccccccccccccccccccccccc",
  "obligations": [],
  "not_reproduced": [],
  "authority": {
    "pressure_semantics": "MNCDS",
    "rights_semantics": "mncs-rights-provenance",
    "coordination_exchange": "MNCS-Commons",
    "language_capability": "mncs-language",
    "assurance_semantics": "mncs-forge",
    "transport": "mncs-actions"
  },
  "promotion": "observation only; no pressure observation authorizes a change",
  "observation": {
    "observation_id": "sha256:ffffffffffffffffffffffffffffffffffffffffffffffffffffffffffffffff",
    "kind": "family-evaluation",
    "resolution_status": "NOT_ESTABLISHED",
    "semantic_resolution_authority": "fixture-authority",
    "promotion_status": "INDEPENDENT_REVIEW_REQUIRED"
  }
}
